<?xml version="1.0" encoding="UTF-8"?>
<unit_armors xmlns:xsi="http://www.w3.org/2001/XMLSchema-instance"
	xsi:noNamespaceSchemaLocation="validation/punkapocalyptic-model-unit-armor.xsd">
	<unit_armor>
		<unit>addler</unit>
		<armor>unarmored</armor>
	</unit_armor>
	<unit_armor>
		<unit>bobblehead</unit>
		<armor>unarmored</armor>
	</unit_armor>
	<unit_armor>
		<unit>chief</unit>
		<armor>hardened_leather</armor>
		<armors>
			<armor>
				<name>bulletproof_vest</name>
				<cost>10</cost>
			</armor>
			<armor>
				<name>metallic_armor</name>
				<cost>10</cost>
			</armor>
		</armors>
	</unit_armor>
	<unit_armor>
		<unit>badass</unit>
		<armor>thick_clothes</armor>
		<armors>
			<armor>
				<name>hardened_leather</name>
				<cost>5</cost>
			</armor>
			<armor>
				<name>metallic_armor</name>
				<cost>15</cost>
			</armor>
		</armors>
	</unit_armor>
	<unit_armor>
		<unit>brute</unit>
		<armor>hardened_leather</armor>
		<armors>
			<armor>
				<name>metallic_armor</name>
				<cost>10</cost>
			</armor>
			<armor>
				<name>metal_plate</name>
				<cost>15</cost>
			</armor>
		</armors>
	</unit_armor>
	<unit_armor>
		<unit>ganger</unit>
		<armor>thick_clothes</armor>
		<armors>
			<armor>
				<name>hardened_leather</name>
				<cost>5</cost>
			</armor>
		</armors>
	</unit_armor>
	<unit_armor>
		<unit>mongrelmorph</unit>
		<armor>unarmored</armor>
	</unit_armor>
	<unit_armor>
		<unit>mutard</unit>
		<armor>unarmored</armor>
	</unit_armor>
	<unit_armor>
		<unit>pit_beast</unit>
		<armor>unarmored</armor>
	</unit_armor>
	<unit_armor>
		<unit>scumbag</unit>
		<armor>thick_clothes</armor>
	</unit_armor>
</unit_armors>